{
  "schemaVersion": "fleet.agent-testing.manifest.v1",
  "id": "fixture.good",
  "platform": "web",
  "journey": "search",
  "candidate": "fixture-driver",
  "sample": "screening",
  "workingDirectory": ".",
  "runs": { "warm": 2, "cold": 1 },
  "phases": {
    "workflow": {
      "command": ["node", "adapter.mjs", "workflow"],
      "timeoutMs": 2000
    },
    "verification": {
      "command": ["node", "adapter.mjs", "verify-good"],
      "timeoutMs": 2000
    }
  }
}
